{
  "$schema": "http://json-schema.org/draft-07/schema#",
  "title": "Clinical History Case",
  "type": "object",
  "properties": {
    "case_id": { "type": "string" },
    "language": { "type": "string" },
    "age": { "type": "integer" },
    "sex": { "type": "string", "enum": ["Male", "Female", "Other"] },
    "chief_complaint": { "type": "string" },
    "patient_statement": { "type": "string" },
    "duration": { "type": "string" },
    "onset": { "type": "string" },
    "location": { "type": "string" },
    "character": { "type": "string" },
    "severity": { "type": "string" },
    "associated_symptoms": { "type": "array", "items": { "type": "string" } },
    "aggravating_factors": { "type": "array", "items": { "type": "string" } },
    "relieving_factors": { "type": "array", "items": { "type": "string" } },
    "past_medical_history": { "type": "array", "items": { "type": "string" } },
    "past_surgical_history": { "type": "array", "items": { "type": "string" } },
    "drug_history": { "type": "array", "items": { "type": "string" } },
    "allergy_history": { "type": "array", "items": { "type": "string" } },
    "family_history": { "type": "array", "items": { "type": "string" } },
    "personal_history": { "type": "array", "items": { "type": "string" } },
    "review_of_systems": { "type": "array", "items": { "type": "string" } },
    "expected_follow_up_questions": { "type": "array", "items": { "type": "string" } },
    "missing_information": { "type": "array", "items": { "type": "string" } },
    "structured_history": { "type": "object" },
    "red_flags": { "type": "array", "items": { "type": "string" } },
    "ground_truth": { "type": "boolean" },
    "review_status": { "type": "string", "enum": ["draft", "reviewed", "clinician_validated"] }
  },
  "required": ["case_id", "language", "age", "sex", "chief_complaint", "patient_statement"]
}
