[
  {
    "case_id": "CASE_001",
    "language": "English",
    "age": 45,
    "sex": "Male",
    "chief_complaint": "Chest pain",
    "patient_statement": "I have been having this heavy pain in my chest since morning.",
    "duration": "8 hours",
    "onset": "Sudden",
    "location": "Central chest",
    "character": "Heavy, crushing",
    "severity": "8/10",
    "associated_symptoms": ["Sweating", "Breathlessness"],
    "aggravating_factors": ["Walking"],
    "relieving_factors": ["Resting"],
    "past_medical_history": ["Hypertension"],
    "past_surgical_history": [],
    "drug_history": ["Amlodipine 5mg"],
    "allergy_history": ["Penicillin"],
    "family_history": ["Father had a heart attack at 50"],
    "personal_history": ["Smoker"],
    "review_of_systems": [],
    "expected_follow_up_questions": ["Is the pain spreading anywhere?", "Any dizziness?"],
    "missing_information": [],
    "structured_history": {},
    "red_flags": ["Potential acute chest-pain emergency"],
    "ground_truth": true,
    "review_status": "clinician_validated"
  },
  {
    "case_id": "CASE_002",
    "language": "English",
    "age": 28,
    "sex": "Female",
    "chief_complaint": "Fever and headache",
    "patient_statement": "I've had a high fever and a throbbing headache for two days.",
    "duration": "2 days",
    "onset": "Gradual",
    "location": "Whole head",
    "character": "Throbbing",
    "severity": "6/10",
    "associated_symptoms": ["Body ache", "Weakness"],
    "aggravating_factors": ["Light", "Noise"],
    "relieving_factors": ["Paracetamol"],
    "past_medical_history": [],
    "past_surgical_history": [],
    "drug_history": [],
    "allergy_history": [],
    "family_history": [],
    "personal_history": [],
    "review_of_systems": [],
    "expected_follow_up_questions": ["Any vomiting?", "Any neck stiffness?", "Any rash?"],
    "missing_information": [],
    "structured_history": {},
    "red_flags": [],
    "ground_truth": true,
    "review_status": "clinician_validated"
  }
]
